{
  "schema_version": 1,
  "revision": 2,
  "compaction_watermark": 0,
  "server_time": "2026-09-26T08:00:00Z",
  "instances": [
    {
      "schema_version": 1,
      "instance_id": "runtime-a",
      "session_id": "ses_018f6b6e-8a2e-7c3a-8b2a-6d1e2f3a4b5c",
      "service_id": "image-runtime",
      "environment": "production",
      "generation": 1,
      "resource_version": 1,
      "registry_revision": 1,
      "lease_id": "lease_018f6b6e-8a2e-7c3a-8b2a-6d1e2f3a4b5c",
      "lease_expires_at": "2026-09-26T08:00:30Z",
      "endpoint": {"base_url": "https://runtime.internal.example", "health_path": "/v1/health/ready"},
      "bindings": [{"agent_id": "image.generate", "agent_version": "1.0.0", "skill_ids": ["default"], "manifest_digest": "sha256:aaaaaaaaaaaaaaaaaaaaaaaaaaaaaaaaaaaaaaaaaaaaaaaaaaaaaaaaaaaaaaaa"}],
      "runtime": {
        "healthy": true,
        "ready": true,
        "runtime_version": "2026.09.26",
        "protocol_versions": ["1.0"],
        "transport_profiles": ["direct"],
        "capabilities": {"streaming": true, "stream_resume": true, "cancellation": true, "status_query": true, "event_outbox": "durable"},
        "capacity": {"max_concurrency": 2, "max_queue_depth": 4, "active_runs": 1, "available_slots": 1, "queue_depth": 0},
        "labels": {"region": "cn-east"}
      },
      "operator": {"enabled": true, "weight": 100, "priority": 10},
      "draining": false,
      "status": "registered"
    }
  ]
}
